product_name,product_asin,product_price,product_ratings,product_ratings_num,product_link,product_image
"Stainless Steel Cosmetic Makeup Palette, Professional Cosmetic Mixing Makeup Palette Spatula Makeup Artist Tool, Beauty Salon Color Cream Mixing Palette With A Spatula Makeup Nail Art Palette",B07YV5JNMW,4.99,4.7 out of 5 stars,"5,303",https://www.amazon.com/Stainless-Cosmetic-Palette-Professional-Spatula/dp/B07YV5JNMW/ref=sr_1_1?keywords=make+up+tool&qid=1685677970&sr=8-1,https://m.media-amazon.com/images/I/4162CG4JDnL._AC_UL400_.jpg
"Eyeliner Stencils 5 in 1 Silicone Eyeliner Stencils Reusable Winged Liner for Multi-Purpose Makeup Tool, Multi-Purpose Makeup Tool for Winged Eyeliner.(Purple)",B0BLD6GBN6,8.99,3.4 out of 5 stars,45,https://www.amazon.com/Eyeliner-Stencils-Silicone-Multi-Purpose-Eyeliner/dp/B0BLD6GBN6/ref=sr_1_2?keywords=make+up+tool&qid=1685677970&sr=8-2,https://m.media-amazon.com/images/I/51cMm3r+81L._AC_UL400_.jpg
Eyeliner Stencils Pencil Liquid Liner Gel Stamp Pen For Beginners Use Thin Angled Eye Brush Waterproof Makeup Wing Tips Eyeshadow Brushes Eyebrow Kit Stencil Sharpener Black Fine Point Winged Tip Pot,B0973MNRBX,4.93,3.9 out of 5 stars,"3,696",https://www.amazon.com/Eyeliner-Stencils-Eyebrow-Stencil-Waterproof/dp/B0973MNRBX/ref=sr_1_3?keywords=make+up+tool&qid=1685677970&sr=8-3,https://m.media-amazon.com/images/I/61L3zT0Lv3L._AC_UL400_.jpg
Sibba 2 Pieces Triangle Powder Puffs Face Cosmetic Powder Puff Washable Reusable Soft Plush Powder Sponge Makeup Foundation Sponge for Face Body Loose Powder Wet Dry Makeup Tool,B0BJJS2W94,3.21,4.7 out of 5 stars,"3,584",https://www.amazon.com/Sibba-Triangle-Cosmetic-Washable-Foundation/dp/B0BJJS2W94/ref=sr_1_4?keywords=make+up+tool&qid=1685677970&sr=8-4,https://m.media-amazon.com/images/I/619zC3ebbcL._AC_UL400_.jpg
"2 PCS YASNAI Lash Clip Applicator False Eyelashes Applicator Tool for Wear Eyelashes, Lashes Buddy Makeup Tools Lash Tweezers More Convenient to Wear Lashes",B0BK1XGBTK,5.88,4.1 out of 5 stars,669,https://www.amazon.com/YASNAI-Applicator-Eyelashes-Tweezers-Convenient/dp/B0BK1XGBTK/ref=sr_1_5?keywords=make+up+tool&qid=1685677970&sr=8-5,https://m.media-amazon.com/images/I/61nh+Z1Zf4L._AC_UL400_.jpg
"SALOCY Finger Puff, 25 Pcs Finger Powder Puff Mini Makeup Sponge Puff for Foundation Concealer Cosmetic Beauty Makeup Tools",B0B6ZQ5XQN,7.88,4.8 out of 5 stars,14,https://www.amazon.com/SALOCY-Finger-Foundation-Concealer-Cosmetic/dp/B0B6ZQ5XQN/ref=sr_1_6?keywords=make+up+tool&qid=1685677970&sr=8-6,https://m.media-amazon.com/images/I/71bc6blEwcL._AC_UL400_.jpg
"12 Pcs Velour Makeup Powder Puff, ALECPEA Triangle Powder Puff for Loose Powder Cosmetic Foundation Beauty Blender Sponge Makeup Tools for Contouring, Under Eyes and Corners - 2.76inch, Black",B0BCQ17W6Z,3.99,4.7 out of 5 stars,227,https://www.amazon.com/ALECPEA-Triangle-Cosmetic-Foundation-Contouring/dp/B0BCQ17W6Z/ref=sr_1_7?keywords=make+up+tool&qid=1685677970&sr=8-7,https://m.media-amazon.com/images/I/71GelYLG0XL._AC_UL400_.jpg
"Makeup Sponge, Set Beauty Blender,Dry and Wet Use Makeup Sponges for Liquid,Powder, Cream, Multi-shape Foundation Makeup tools Makeup Egg Set (8 pcs, Pink)",B09G3JH7M7,6.99,4.6 out of 5 stars,245,https://www.amazon.com/Green-Myuu-Sponges-Multi-shape-Foundation/dp/B09G3JH7M7/ref=sr_1_8?keywords=make+up+tool&qid=1685677970&sr=8-8,https://m.media-amazon.com/images/I/41HvJqoEP5S._AC_UL400_.jpg
"URGINO 5 in 1 Silicone Eyeliner Stencils Reusable Clean Winged Liner for Eyes,Make up Tools as Eyelash Shield/Eyebrow Shaping/Jaw Line/Lip Line for Beginners(Pink)…",B0BHS85TGD,4.99,3.9 out of 5 stars,54,https://www.amazon.com/URGINO-Silicone-Eyeliner-Stencils-Beginners/dp/B0BHS85TGD/ref=sr_1_9?keywords=make+up+tool&qid=1685677970&sr=8-9,https://m.media-amazon.com/images/I/510myEtCxnL._AC_UL400_.jpg
"Eyeliner Stencils Reusable Silicone Winged Tip Eyeliner Aid Eyebrow Pencil Stencil 5 in1 Eyeliner Stencils for Hooded Eyes, Multi-Purpose Makeup Tool for Winged Eyeliner, for Beginners Makeup Tools",B0BLCY2KMG,8.99,4.0 out of 5 stars,11,https://www.amazon.com/Eyeliner-Stencils-Reusable-Multi-Purpose-Beginners/dp/B0BLCY2KMG/ref=sr_1_10?keywords=make+up+tool&qid=1685677970&sr=8-10,https://m.media-amazon.com/images/I/512wRnw4ljL._AC_UL400_.jpg
111 Black makeup brushes and makeup sponges 18pcs makeup tool set makeup brushes set natural synthetic eye shadow foundation make-up facial mixed powder blusher concealer eye makeup brush set professional makeup brush and tool accessories,B09CM7NGJD,9.99,4.6 out of 5 stars,"2,142",https://www.amazon.com/111-Synthetic-Eyeshadow-Foundation-Concealers/dp/B09CM7NGJD/ref=sr_1_11?keywords=make+up+tool&qid=1685677970&sr=8-11,https://m.media-amazon.com/images/I/71m7p6qBAHL._AC_UL400_.jpg
NINGLASH False Eyelash Applicator Tool Lash Clip Eye Makeup Tools Eyelash Tweezer Lashes Buddy More Convenient to Wear Lashes,B0BHQK4LSC,3.86,4.0 out of 5 stars,186,https://www.amazon.com/NINGLASH-Eyelash-Applicator-Tweezer-Convenient/dp/B0BHQK4LSC/ref=sr_1_12?keywords=make+up+tool&qid=1685677970&sr=8-12,https://m.media-amazon.com/images/I/61oHxL+ZvJL._AC_UL400_.jpg
Eyelash Comb Separator MSQ Eyelash Mascara Brush and Comb Lash Separator With Comb Cover Arc Designed Cosmetic Brushes Tool Pink (1PCS),B0B2DH8WCG,4.99,4.3 out of 5 stars,"18,722",https://www.amazon.com/Eyelash-Separator-MSQ-Designed-Cosmetic/dp/B0B2DH8WCG/ref=sr_1_13?keywords=make+up+tool&qid=1685677970&sr=8-13,https://m.media-amazon.com/images/I/51-9grzpUaL._AC_UL400_.jpg
Makeup Brushes Set Professional-32Pcs Cosmetic Brushes Makeup Brush Set for Foundation Blush Blending Eyeshadow Makeup Tools,B0BXSTBL68,4.49,3.8 out of 5 stars,9,https://www.amazon.com/Professional-32Pcs-Cosmetic-Foundation-Blending-Eyeshadow/dp/B0BXSTBL68/ref=sr_1_14?keywords=make+up+tool&qid=1685677970&sr=8-14,https://m.media-amazon.com/images/I/61liSuX1LcL._AC_UL400_.jpg
"Lashes Buddy Eye Lash Mascara Guard Applicator Makeup Cosmetic Eyelash Tool, False Eyelash Applicator Tool Lash Clip Tweezers Eye Makeup Tools More Convenient to Wear Lashes",B0BNZCWG4Z,5.72,4.0 out of 5 stars,69,https://www.amazon.com/Mascara-Applicator-Cosmetic-Tweezers-Convenient/dp/B0BNZCWG4Z/ref=sr_1_15?keywords=make+up+tool&qid=1685677970&sr=8-15,https://m.media-amazon.com/images/I/61mFudoIjyL._AC_UL400_.jpg
"LORMAY Silicone Lip Brushes with Transparent Handles and Caps. Perfect Applicators for Cream Lip Mask, Eyeshadow, and Lipstick (4pcs, Multicolor)",B0B4HC7LPL,7.99,4.6 out of 5 stars,108,https://www.amazon.com/LORMAY-Silicone-Transparent-Eyeshadow-Multicolor/dp/B0B4HC7LPL/ref=sr_1_16?keywords=make+up+tool&qid=1685677970&sr=8-16,https://m.media-amazon.com/images/I/41BzONleD9L._AC_UL400_.jpg
RAREIUS 6pcs Triangular Powder Puff Face Soft Velour Makeup Puff for Loose Powder Body Powder Makeup Sponge for Contouring Wet Dry Foundation Blender Sponge Beauty Makeup Tool. (Pink),B0BV8ZLJ4Z,4.99,4.7 out of 5 stars,40,https://www.amazon.com/RAREIUS-Triangular-Contouring-Foundation-Blender/dp/B0BV8ZLJ4Z/ref=sr_1_17?keywords=make+up+tool&qid=1685677970&sr=8-17,https://m.media-amazon.com/images/I/51l8pL24ftL._AC_UL400_.jpg
"3 Way Mirror for Self Hair Cutting, 360 Trifold Barber Mirrors 3 Sided Makeup Mirror to See Back of Head, Used for Hair Coloring, Braiding, DIY Haircut Tool are Good Gifts for Men Women (Without LED)",B09Y93Z3MK,27.99,4.5 out of 5 stars,"2,164",https://www.amazon.com/Cutting-Trifold-Mirrors-Coloring-Braiding/dp/B09Y93Z3MK/ref=sr_1_18?keywords=make+up+tool&qid=1685677970&sr=8-18,https://m.media-amazon.com/images/I/71JZLYB0X8L._AC_UL400_.jpg
Makeup Brushes Set 7Pcs Professional Super Soft Cosmetic Brushes Portable Pink Makeup Brush Set for Foundation Blush Blending And Eyeshadow Makeup Tools,B0B978QT32,9.83,4.6 out of 5 stars,103,https://www.amazon.com/Professional-Cosmetic-Portable-Foundation-Eyeshadow/dp/B0B978QT32/ref=sr_1_19?keywords=make+up+tool&qid=1685677970&sr=8-19,https://m.media-amazon.com/images/I/51Dc3G0E-ZL._AC_UL400_.jpg
2 PCS Lash Clip Lashes Buddy False Eyelash Applicator Tool Eye Makeup Tools Eyelashes Clip More Convenient to Wear Lashes,B0BNZ3ZYG6,4.99,4.3 out of 5 stars,222,https://www.amazon.com/Lashes-Eyelash-Applicator-Eyelashes-Convenient/dp/B0BNZ3ZYG6/ref=sr_1_20?keywords=make+up+tool&qid=1685677970&sr=8-20,https://m.media-amazon.com/images/I/51HtfEY3ksL._AC_UL400_.jpg
"Electric Makeup Brush Cleaner Machine, Portable Automatic Spinner Brush Cleaner Tools for All Size Makeup Brushes, Make Up Brush Cleaner Cleanser Gifts for Women Girlfriend Wife Mom Daughter(black)",B0BWY3QJ71,18.99,5.0 out of 5 stars,16,https://www.amazon.com/gp/slredirect/picassoRedirect.html/ref=pa_sp_mtf_aps_sr_pg1_1?ie=UTF8&adId=A07566352SRFVKMG6PGOX&url=%2FElectric-Portable-Automatic-Cleanser-Girlfriend%2Fdp%2FB0BWY3QJ71%2Fref%3Dsr_1_21_sspa%3Fkeywords%3Dmake%2Bup%2Btool%26qid%3D1685677970%26sr%3D8-21-spons%26psc%3D1&qualifier=1685677970&id=8992351909302051&widgetName=sp_mtf,https://m.media-amazon.com/images/I/711M-OHFOFL._AC_UL400_.jpg
"FERYES Large Travel Makeup Brush Holder, Magnetic Anti-fall Out Silicon Portable Cosmetic Face Brushes Holder, Soft and Sleek Makeup Tools Organizer for Travel- (8.27 * 2.36 * 1.57)",B0BG3ZPWBX,13.59,4.5 out of 5 stars,"2,095",https://www.amazon.com/gp/slredirect/picassoRedirect.html/ref=pa_sp_mtf_aps_sr_pg1_1?ie=UTF8&adId=A0116932U9JRODRMA464&url=%2FFERYES-Magnetic-Anti-fall-Portable-Organizer%2Fdp%2FB0BG3ZPWBX%2Fref%3Dsr_1_22_sspa%3Fkeywords%3Dmake%2Bup%2Btool%26qid%3D1685677970%26sr%3D8-22-spons%26psc%3D1&qualifier=1685677970&id=8992351909302051&widgetName=sp_mtf,https://m.media-amazon.com/images/I/5192uFUJjWL._AC_UL400_.jpg
"BS-MALL Makeup Brushes Premium Synthetic Foundation Powder Concealers Eye Shadows Makeup 14 Pcs Brush Set, Coffee Brown Color",B0B6FG5ZXW,13.99,4.5 out of 5 stars,"2,403",https://www.amazon.com/gp/slredirect/picassoRedirect.html/ref=pa_sp_mtf_aps_sr_pg1_1?ie=UTF8&adId=A103060712FCFBTVY8RFE&url=%2FBS-MALL-Brushes-Synthetic-Foundation-Concealers%2Fdp%2FB0B6FG5ZXW%2Fref%3Dsr_1_23_sspa%3Fkeywords%3Dmake%2Bup%2Btool%26qid%3D1685677970%26sr%3D8-23-spons%26psc%3D1&qualifier=1685677970&id=8992351909302051&widgetName=sp_mtf,https://m.media-amazon.com/images/I/81BHqwpFG5L._AC_UL400_.jpg
"Electric Makeup Brush Cleaner, Make up Brush Clean Machine, Brush Cleaning Mat, Valentines Day Gifts for Her, Mothers Day Gifts from Daughter Son, Christmas Gifts Stocking Stuffers for Women Mom Wife",B0B1JP4SC5,19.99,4.2 out of 5 stars,372,https://www.amazon.com/gp/slredirect/picassoRedirect.html/ref=pa_sp_mtf_aps_sr_pg1_1?ie=UTF8&adId=A0187520RU2RD6L93LQV&url=%2FElectric-Cleaning-Automatic-Christmas-Girlfriend%2Fdp%2FB0B1JP4SC5%2Fref%3Dsr_1_24_sspa%3Fkeywords%3Dmake%2Bup%2Btool%26qid%3D1685677970%26sr%3D8-24-spons%26psc%3D1&qualifier=1685677970&id=8992351909302051&widgetName=sp_mtf,https://m.media-amazon.com/images/I/61ZDLrUwZZL._AC_UL400_.jpg
"Silicone Face Mask Brush DUAIU Face Mask Applicator Facial Tools and Facial Brush for Facial Mask, Eye Mask, Cream, Mud, Clay, Mixed Mask, DIY Mask (2PCS-Pink & Green)",B0BRM6W3DF,3.99,4.6 out of 5 stars,430,https://www.amazon.com/Silicone-DUAIU-Applicator-Facial-2PCS-Pink/dp/B0BRM6W3DF/ref=sr_1_25?keywords=make+up+tool&qid=1685677970&sr=8-25,https://m.media-amazon.com/images/I/41aa55pPadL._AC_UL400_.jpg
"VYH False Eyelashes Applicator Tool for Wear Eyelashes, Makeup Tools More Convenient to Wear Lashes, False Eyelash Wearing Aids, False Eyelash Aids, 2 Pack",B0BLNHT6SR,6.99,4.0 out of 5 stars,165,https://www.amazon.com/VYH-Eyelashes-Applicator-Convenient-Eyelash/dp/B0BLNHT6SR/ref=sr_1_26?keywords=make+up+tool&qid=1685677970&sr=8-26,https://m.media-amazon.com/images/I/51lCImgBHDL._AC_UL400_.jpg
"Face Mask Applicator Brushes, Mini Makeup Spatula Portable Beauty Tools Set for Facial Mud, Cosmetic Mask, Facial Clay, Eye Mask, Body Lotion, Body Butter, Serum, Cream. 3PCS Soft Silicone Brush Suit",B09MQ8YXTS,6.99,4.5 out of 5 stars,230,https://www.amazon.com/Applicator-Brushes-Portable-Cosmetic-Silicone/dp/B09MQ8YXTS/ref=sr_1_27?keywords=make+up+tool&qid=1685677970&sr=8-27,https://m.media-amazon.com/images/I/517rH9u3+tL._AC_UL400_.jpg
Deacocal Eyeliner Stencils 4Pcs Reusable Silicone Eyeliner Aid Mascara Shield Eyeliner Eyelash Eyeshadow Lipstick Applicator Guide Tool Multifunctional Eye Makeup Tool Easy to Use (Purple),B0C1BSYWJ3,8.99,5.0 out of 5 stars,3,https://www.amazon.com/Deacocal-Eyeliner-Eyeshadow-Applicator-Multifunctional/dp/B0C1BSYWJ3/ref=sr_1_28?keywords=make+up+tool&qid=1685677970&sr=8-28,https://m.media-amazon.com/images/I/619XMZI4kUL._AC_UL400_.jpg
"SOGUE Electric Makeup Brush cleaner with Silica gel mat bowl Portable Automatic USB Type-C 5V 1A Cosmetic make up brush cleaner Machine Tools, beauty brushs cleaner powered washer (blue)",B0BXY2HW3Y,19.99,4.1 out of 5 stars,57,https://www.amazon.com/gp/slredirect/picassoRedirect.html/ref=pa_sp_mtf_aps_sr_pg1_1?ie=UTF8&adId=A0165076HCPPHB0B4SFH&url=%2FSOGUE-Electric-Portable-Automatic-Cosmetic%2Fdp%2FB0BXY2HW3Y%2Fref%3Dsr_1_29_sspa%3Fkeywords%3Dmake%2Bup%2Btool%26qid%3D1685677970%26sr%3D8-29-spons%26psc%3D1%26smid%3DA1SWVK1JTMA05D&qualifier=1685677970&id=8992351909302051&widgetName=sp_mtf,https://m.media-amazon.com/images/I/611h152UdFL._AC_UL400_.jpg
"MIRRORVANA 10X Magnifying Makeup Mirror on Round Stand for Tabletop, Bedroom Vanity Desk and Bathroom Counter - Free Standing Double Sided 10X/1X Magnification Mirror - 7"" Wide and 14"" Tall (Chrome)",B00YTZ2S0M,24.99,4.6 out of 5 stars,"3,758",https://www.amazon.com/gp/slredirect/picassoRedirect.html/ref=pa_sp_mtf_aps_sr_pg1_1?ie=UTF8&adId=A054841829NQNRG9KGA5M&url=%2FMirrorvana-Double-Magnifying-Makeup-Diameter%2Fdp%2FB00YTZ2S0M%2Fref%3Dsr_1_30_sspa%3Fkeywords%3Dmake%2Bup%2Btool%26qid%3D1685677970%26sr%3D8-30-spons%26psc%3D1&qualifier=1685677970&id=8992351909302051&widgetName=sp_mtf,https://m.media-amazon.com/images/I/61t11FJoIjL._AC_UL400_.jpg
"FASCINATE Handheld Mirror, 1x 10x Magnifying Makeup Mirror with Handle, Two Sided Mirror, 10X/1X Magnification Portable Small Mirror Rechargeable with Swivel Handle for Women",B09WD2RYW9,15.99,4.3 out of 5 stars,278,https://www.amazon.com/gp/slredirect/picassoRedirect.html/ref=pa_sp_mtf_aps_sr_pg1_1?ie=UTF8&adId=A04433031QJDM9XNALJ5T&url=%2FFASCINATE-Handheld-Magnifying-Magnification-Rechargeable%2Fdp%2FB09WD2RYW9%2Fref%3Dsr_1_31_sspa%3Fkeywords%3Dmake%2Bup%2Btool%26qid%3D1685677970%26sr%3D8-31-spons%26psc%3D1&qualifier=1685677970&id=8992351909302051&widgetName=sp_mtf,https://m.media-amazon.com/images/I/51489Gx7EhL._AC_UL400_.jpg
"AMZNEVO Rechargeable 8'' Lighted Makeup Mirror, 10X Magnifying Vanity Mirror with 3 Color LED Lights, Double-Sided Cosmetic Mirror Battery Powered, Touch Button Adjust Brightness",B08S372LKS,38.99,4.3 out of 5 stars,"1,765",https://www.amazon.com/gp/slredirect/picassoRedirect.html/ref=pa_sp_mtf_aps_sr_pg1_1?ie=UTF8&adId=A08430212OKDS794IFNIV&url=%2FRechargeable-Magnifying-Double-Sided-Cosmetic-Brightness%2Fdp%2FB08S372LKS%2Fref%3Dsr_1_32_sspa%3Fkeywords%3Dmake%2Bup%2Btool%26qid%3D1685677970%26sr%3D8-32-spons%26psc%3D1&qualifier=1685677970&id=8992351909302051&widgetName=sp_mtf,https://m.media-amazon.com/images/I/51TEFlwK1HL._AC_UL400_.jpg
4 Pairs Eyeliner Eyeshadow Stencils Cat Winged Eyeliner Sticker Cut Crease Eyeshadow Stamp Pads Quick Smokey Eye Tool Eye Line Tape for Beginners Makeup Artist Supplies Must Haves (cat Card),B09Y9CM3Y5,3.38,3.0 out of 5 stars,63,https://www.amazon.com/Eyeliner-Eyeshadow-Stencils-Beginners-Supplies/dp/B09Y9CM3Y5/ref=sr_1_33?keywords=make+up+tool&qid=1685677970&sr=8-33,https://m.media-amazon.com/images/I/71hz0crFkaL._AC_UL400_.jpg
"Makeup Brushes Set for Women Professional,UorPoto 10Pcs Sponge Eyeshadow Brush Sets Applicator Double Sided reusable",B09GW5FM7T,6.99,4.5 out of 5 stars,"1,025",https://www.amazon.com/Professional-UorPoto-Eyeshadow-Applicator-reusable/dp/B09GW5FM7T/ref=sr_1_34?keywords=make+up+tool&qid=1685677970&sr=8-34,https://m.media-amazon.com/images/I/71PPOaTCFwL._AC_UL400_.jpg
"HOSAILY 2PCS 5 in1 Eyeliner Stencils Silicone Winged Tip Eyeliner Aid Eyebrow Pencil Stencils Multi-Purpose Eye Makeup Tool for Winged Eyeliner, Defined Eyebrow, Eyelash, Face Contour and Lip Line",B0BL7DRHH7,7.99,3.8 out of 5 stars,16,https://www.amazon.com/HOSAILY-Eyeliner-Stencils-Silicone-Multi-Purpose/dp/B0BL7DRHH7/ref=sr_1_35?keywords=make+up+tool&qid=1685677970&sr=8-35,https://m.media-amazon.com/images/I/6134szqwLVL._AC_UL400_.jpg
"Winged Eyeliner Stamp, Liquid Colored Eyeliners, Waterproof Eyeliner Smudge Proof Quick Dry Smooth No Fading, 2 In 1 Cat Eye Stamp Liquid Liner Long Lasting Wear, Female Eye Makeup Tool (Dark Brown)",B0C17959RZ,5.49,0,0,https://www.amazon.com/Eyeliner-Colored-Eyeliners-Waterproof-Lasting/dp/B0C17959RZ/ref=sr_1_36?keywords=make+up+tool&qid=1685677970&sr=8-36,https://m.media-amazon.com/images/I/61hqgn+qflL._AC_UL400_.jpg
"Bvcewilty Oxygen Facial Portable Airbrush, Skin Care Nano Facial Steamer – Portable Makeup Airbrush，Serum Toner Nano Mist Sprayer Facial Mister Device, Lady‘s Gifts Skin Care Tool",B09Q3RRRBH,69.99,3.8 out of 5 stars,57,https://www.amazon.com/gp/slredirect/picassoRedirect.html/ref=pa_sp_mtf_aps_sr_pg1_1?ie=UTF8&adId=A038248918BA7QLF7Y0AJ&url=%2FBvcewilty-Oxygen-Portable-Airbrush-Steamer%2Fdp%2FB09Q3RRRBH%2Fref%3Dsr_1_37_sspa%3Fkeywords%3Dmake%2Bup%2Btool%26qid%3D1685677970%26sr%3D8-37-spons%26psc%3D1&qualifier=1685677970&id=8992351909302051&widgetName=sp_mtf,https://m.media-amazon.com/images/I/61pGqU7rCsL._AC_UL400_.jpg
"OMIRO 20X Magnifying Mirror and Eyebrow Tweezers Kit, 3.5"" Three Suction Cups Magnifier Travel Set",B0B74K3679,7.29,4.3 out of 5 stars,671,https://www.amazon.com/gp/slredirect/picassoRedirect.html/ref=pa_sp_mtf_aps_sr_pg1_1?ie=UTF8&adId=A06491454ID0CM30M7VJ&url=%2FOMIRO-Magnifying-Eyebrow-Tweezers-Magnifier%2Fdp%2FB0B74K3679%2Fref%3Dsr_1_38_sspa%3Fkeywords%3Dmake%2Bup%2Btool%26qid%3D1685677970%26sr%3D8-38-spons%26psc%3D1&qualifier=1685677970&id=8992351909302051&widgetName=sp_mtf,https://m.media-amazon.com/images/I/61j6epSH8nL._AC_UL400_.jpg
BS-MALL Makeup Brush Set 18 Pcs Premium Synthetic Foundation Powder Concealers Eye shadows Blush Makeup Brushes with black case (A-Champagne),B07MH1KHJ2,11.99,4.6 out of 5 stars,"33,868",https://www.amazon.com/gp/slredirect/picassoRedirect.html/ref=pa_sp_mtf_aps_sr_pg1_1?ie=UTF8&adId=A07414041L25XG27BPHCD&url=%2FBS-MALL-Brushes-Synthetic-Foundation-Concealers%2Fdp%2FB07MH1KHJ2%2Fref%3Dsr_1_39_sspa%3Fkeywords%3Dmake%2Bup%2Btool%26qid%3D1685677970%26sr%3D8-39-spons%26psc%3D1&qualifier=1685677970&id=8992351909302051&widgetName=sp_mtf,https://m.media-amazon.com/images/I/715BUa3vqSL._AC_UL400_.jpg
"MUBA COSMETICS Professional Makeup Brush Set - 18pcs Face Makeup Brushes Set with Eye Makeup Brushes, Foundation Brush, Concealer Brush & More - Ultra Soft Make Up Brushes, Eyeshadow Brush Set with Matte Tubby for Storage",B0BVQ9KDS3,79.99,5.0 out of 5 stars,2,https://www.amazon.com/gp/slredirect/picassoRedirect.html/ref=pa_sp_mtf_aps_sr_pg1_1?ie=UTF8&adId=A01329051F45SUFI8MRTU&url=%2FMUBA-COSMETICS-Professional-Makeup-Brush%2Fdp%2FB0BVQ9KDS3%2Fref%3Dsr_1_40_sspa%3Fkeywords%3Dmake%2Bup%2Btool%26qid%3D1685677970%26sr%3D8-40-spons%26psc%3D1&qualifier=1685677970&id=8992351909302051&widgetName=sp_mtf,https://m.media-amazon.com/images/I/714+GjOw7dL._AC_UL400_.jpg
"Finger Puff,6 Pcs Cute Rabbit Mini Makeup puff,Finger Makeup Sponges,Suitable For Foundation, Concealer, Eye Shadow,Beauty Makeup Tools (5 Color 1 Set)",B0C3CLHQ17,3.99,4.6 out of 5 stars,3,https://www.amazon.com/Finger-Sponges-Suitable-Foundation-Concealer/dp/B0C3CLHQ17/ref=sr_1_41?keywords=make+up+tool&qid=1685677970&sr=8-41,https://m.media-amazon.com/images/I/61uL9leMDEL._AC_UL400_.jpg
"Hiyotec Powder Puff Triangle Makeup Puff for Face, Soft Velour Powder Puffs for Loose Setting Powder, 2 Pieces Puffs with Case, Under Eye Foundation Blender Wedge Beauty Makeup Tools (Black)",B0BY867CBS,2.99,4.8 out of 5 stars,100,https://www.amazon.com/Hiyotec-Triangle-Setting-Foundation-Blender/dp/B0BY867CBS/ref=sr_1_42?keywords=make+up+tool&qid=1685677970&sr=8-42,https://m.media-amazon.com/images/I/71+orCaTvFL._AC_UL400_.jpg
Charme Princesse Eyebrow Ruler Stainless Steel Tattoo Eyebrow Stencil Ruler Three-Point Positioning Permanent Eyebrow Makeup Measuring Symmetrical tool(Black) LB000249-1,B09SHQGS8M,13.99,3.9 out of 5 stars,68,https://www.amazon.com/Charme-Princesse-Three-Point-Positioning-Symmetrical/dp/B09SHQGS8M/ref=sr_1_43?keywords=make+up+tool&qid=1685677970&sr=8-43,https://m.media-amazon.com/images/I/61qEGalgcRL._AC_UL400_.jpg
"Professional Stainless Steel Makeup Palettes Makeup Spatula set, Makeup Spatula makeup palette Makeup Art Tool For Nail Art Eye Shadow Eyelash Makeup Pigment Blending, with Makeup Powder Puff 2pcs",B0BZL9YDVP,7.99,0,0,https://www.amazon.com/Professional-Stainless-Makeup-Spatula-set/dp/B0BZL9YDVP/ref=sr_1_44?keywords=make+up+tool&qid=1685677970&sr=8-44,https://m.media-amazon.com/images/I/61m2uc+lfhL._AC_UL400_.jpg
AUGENLI 10 Pairs Fox Eye lashes 3D Effected Flufy Wispy Eyelashes Anime Makeup Tools Eyelash Extension for Party Create Gorgeous Makeup (B5),B0BT8V2JNW,9.99,4.1 out of 5 stars,71,https://www.amazon.com/AUGENLI-Effected-Eyelashes-Extension-Gorgeous/dp/B0BT8V2JNW/ref=sr_1_45?keywords=make+up+tool&qid=1685677970&sr=8-45,https://m.media-amazon.com/images/I/81kbHmv8Y-L._AC_UL400_.jpg
"EcoTools Green Tea Bioblender, Compostable Makeup Blending Sponge, For Foundation & Base Coverage, Skin-Calming, Natural Infusion, Cruelty Free & Vegan, Packaging May Vary, 1 Count",B0BLT4113B,6.59,4.5 out of 5 stars,420,https://www.amazon.com/EcoTools-Bioblender-Compostable-Foundation-Skin-Calming/dp/B0BLT4113B/ref=sr_1_46?keywords=make+up+tool&qid=1685677970&sr=8-46,https://m.media-amazon.com/images/I/71XIAwdAfWL._AC_UL400_.jpg
"Eyebrow Pencil Eyebrow Microblading Pen - Eyebrow Makeup Micro 4 Point Brow Pen Lift & Snatch Makeup Pen Long-Lasting Waterproof Brow Pen, Creating Natural Looking Brows Effortlessly (Light Brown)",B0BYJCLJ49,11.97,4.5 out of 5 stars,62,https://www.amazon.com/Eyebrow-Pencil-Microblading-Pen-Long-Lasting/dp/B0BYJCLJ49/ref=sr_1_47?keywords=make+up+tool&qid=1685677970&sr=8-47,https://m.media-amazon.com/images/I/71kwm-dZ1JL._AC_UL400_.jpg
Molain 2 Pieces Triangle Powder Puff Makeup Puff Velvet Face Body Powder Puff Cosmetic Foundation Blender Sponge for Loose Powder Body Powder Makeup Tool (Black),B0BBQC3WFL,3.59,4.7 out of 5 stars,787,https://www.amazon.com/Molain-Triangle-Cosmetic-Foundation-Blender/dp/B0BBQC3WFL/ref=sr_1_48?keywords=make+up+tool&qid=1685677970&sr=8-48,https://m.media-amazon.com/images/I/612NWZ+phNL._AC_UL400_.jpg
"8Pcs Eyeliner Stencils for Cat Eye Winged, Cat Eyeliner Stamp Sticker Eyeshadow Stencils for Eyes Smoky Eyeshadow Applicators Guide Tool Quick Makeup Stencil",B0BTSLNRBM,8.99,0,0,https://www.amazon.com/Eyeliner-Stencils-Sticker-Eyeshadow-Applicators/dp/B0BTSLNRBM/ref=sr_1_49?keywords=make+up+tool&qid=1685677970&sr=8-49,https://m.media-amazon.com/images/I/61cglauORRL._AC_UL400_.jpg
"Large Lash Mirror, Detachable Eyelash Mirror Stainless Steel Eyelash Makeup Mirror, Eyelash Extensions Accessories for Lash Extension Supplies",B0BL9FHTPH,4.97,4.7 out of 5 stars,4,https://www.amazon.com/Dfsuiwk-Detachable-Stainless-Extensions-Accessories/dp/B0BL9FHTPH/ref=sr_1_50?keywords=make+up+tool&qid=1685677970&sr=8-50,https://m.media-amazon.com/images/I/61eKOu+oXHL._AC_UL400_.jpg
"HOSAILY 5 in1 Eyeliner Stencils Silicone Multi-Purpose Eye Makeup Tool for Winged Eyeliner, Defined Eyebrow, Eyelash, Face Contour and Lip Line Lazy Quick Makeup Tool-Pink",B0BL6YZ38L,4.99,4.5 out of 5 stars,6,https://www.amazon.com/Eyeliner-Stencils-Silicone-Multi-Purpose-Tool-Pink/dp/B0BL6YZ38L/ref=sr_1_51?keywords=make+up+tool&qid=1685677970&sr=8-51,https://m.media-amazon.com/images/I/41Saf9OCz2L._AC_UL400_.jpg
"KINGMAS 5 Pieces Fine Eyeliner Brush, Angled Eyebrow Brush, Eyelash Separator and Lash Spoolie, Brow Comb Grooming Makeup Tool (B. 5 Pieces Set)",B0C4PL4QFD,7.99,4.4 out of 5 stars,523,https://www.amazon.com/KINGMAS-Eyeliner-Eyebrow-Separator-Grooming/dp/B0C4PL4QFD/ref=sr_1_52?keywords=make+up+tool&qid=1685677970&sr=8-52,https://m.media-amazon.com/images/I/51kveLiw53L._AC_UL400_.jpg
"gootrades Mascara Fan Brush AND Eyelash Comb Eyebrow Brush, Eyelash Separator Mascara Applicator No Smearing Clumping, Lash Wand Brush Fan for Natural Lifted Easy to Use Cosmetic Brushes Tools",B0C14CD2FP,9.99,4.7 out of 5 stars,23,https://www.amazon.com/gootrades-Separator-Applicator-Smearing-Clumping/dp/B0C14CD2FP/ref=sr_1_53?keywords=make+up+tool&qid=1685677970&sr=8-53,https://m.media-amazon.com/images/I/51fUkCObugL._AC_UL400_.jpg
"AQUEEN Eyeliner Brush-3 PCS Precision Gel Fine Eyeliner Brush-Ultra Thin Flat and Angled Eyeliner Brush, Premium Quality Soft Eyeliner Brushes for Makeup Tools.(Black)",B0B3TXYFSB,9.99,4.5 out of 5 stars,93,https://www.amazon.com/AQUEEN-Eyeliner-Brush-3-Precision-Brush-Ultra/dp/B0B3TXYFSB/ref=sr_1_54?keywords=make+up+tool&qid=1685677970&sr=8-54,https://m.media-amazon.com/images/I/61K9mOUcvAL._AC_UL400_.jpg
Purple Lashes Colorful Eyelashes Halloween Easter Faux Mink Eyelashes Colored False Eye Lashes Long Dramatic Party Fake Eyelashes Makeup Tools Halloween Costume Party Eye Lashes Tool Stage Performance 5 Pairs Pack (MQ305-Purple),B0BYJ7FYR8,8.99,4.0 out of 5 stars,126,https://www.amazon.com/Colorful-Eyelashes-Halloween-Performance-MQ305-Purple/dp/B0BYJ7FYR8/ref=sr_1_55?keywords=make+up+tool&qid=1685677970&sr=8-55,https://m.media-amazon.com/images/I/71LqzcstCOL._AC_UL400_.jpg
"2 PCS - False Eyelashes Applicator Tool Tweezers for Wear Eyelashes, Eyelash Clips Makeup Tools More Convenient to Wear Lashes",B0BLW71HMK,4.39,4.0 out of 5 stars,42,https://www.amazon.com/PCS-Eyelashes-Applicator-Tweezers-Convenient/dp/B0BLW71HMK/ref=sr_1_56?keywords=make+up+tool&qid=1685677970&sr=8-56,https://m.media-amazon.com/images/I/414SP52gD0L._AC_UL400_.jpg
